Sheet: Sample Data
A1: Test String 1 | B1: 1 | C1: 5 | E1: A | F1: E | H1: =RC[-6]+RC[-5] -> 6 | J1: =RC[-5]&RC[-4] -> AE
A2: Test - String 2 | B2: 2 | C2: 6 | E2: B | F2: F | H2: =RC[-6]+RC[-5] -> 8 | J2: =RC[-5]&RC[-4] -> BF
A3: Test #3 | B3: 3 | C3: 7 | E3: C | F3: G | H3: =RC[-6]+RC[-5] -> 10 | J3: =RC[-5]&RC[-4] -> CG
A4: Test with (") in string | B4: 4 | C4: 8 | E4: D | F4: H | H4: =RC[-6]+RC[-5] -> 12 | J4: =RC[-5]&RC[-4] -> DH
H5: =SUM(R[-4]C[-6]:R[-1]C[-6]) -> 10 | I5: =SUM(R[-4]C[-6]:R[-1]C[-6]) -> 26 | J5: =SUM(R[-4]C[-8]:R[-1]C[-7]) -> 36
B6: 1.23 | C6: 1
B7: 2.34 | C7: 0
B8: 3.45
A10: 1960-12-19T00:00:00.000 | C10: TOP | G10: =#N/A -> #N/A
A11: 1.5 | G11: =12/0 -> #DIV/0!
C12: BOTTOM
C14: LEFT
C16: RIGHT
B18: BOX | G18: Test Column 1
H19: Test Column 2
I20: Test Column 3

Sheet: Report Data
A1: Heading 1 | B1: Heading 2 | C1: Third Heading | D1: Date Heading | F1: Adjusted Date | G1: Adjusted Number
A2: ABC | B2: 1 | C2: 1.1100000000000001 | D2: 2001-01-01T00:00:00.000 | F2: =RC[-2]-RC[-4] -> 2000-12-31T00:00:00.000 | G2: =RC[-5]*RC[-4] -> 1.1100000000000001
A3: BCD | B3: 2 | C3: 2.2200000000000002 | D3: 2002-02-02T00:00:00.000 | F3: =RC[-2]-RC[-4] -> 2002-01-31T00:00:00.000 | G3: =RC[-5]*RC[-4] -> 4.4400000000000004
A4: CDE | B4: 3 | C4: 3.33 | D4: 2003-03-03T00:00:00.000 | F4: =RC[-2]-RC[-4] -> 2003-02-28T00:00:00.000 | G4: =RC[-5]*RC[-4] -> 9.99
A5: DEF | B5: 4 | C5: 4.4400000000000004 | D5: 2004-04-03T23:00:00.000 | F5: =RC[-2]-RC[-4] -> 2004-03-30T23:00:00.000 | G5: =RC[-5]*RC[-4] -> 17.760000000000002
A6: EFG | B6: 5 | C6: 5.55 | D6: 2005-05-04T23:00:00.000 | F6: =RC[-2]-RC[-4] -> 2005-04-29T23:00:00.000 | G6: =RC[-5]*RC[-4] -> 27.75
A7: FGH | B7: 6 | C7: 6.66 | D7: 2006-06-05T23:00:00.000 | F7: =RC[-2]-RC[-4] -> 2006-05-30T23:00:00.000 | G7: =RC[-5]*RC[-4] -> 39.96
A8: GHI | B8: 7 | C8: 7.77 | D8: 2007-07-06T23:00:00.000 | F8: =RC[-2]-RC[-4] -> 2007-06-29T23:00:00.000 | G8: =RC[-5]*RC[-4] -> 54.39
A9: HIJ | B9: 8 | C9: 8.8800000000000008 | D9: 2008-08-07T23:00:00.000 | F9: =RC[-2]-RC[-4] -> 2008-07-30T23:00:00.000 | G9: =RC[-5]*RC[-4] -> 71.040000000000006
A10: IJK | B10: 9 | C10: 9.99 | D10: 2009-09-08T23:00:00.000 | F10: =RC[-2]-RC[-4] -> 2009-08-30T23:00:00.000 | G10: =RC[-5]*RC[-4] -> 89.91
A11: JKL | B11: 10 | C11: 11.1 | D11: 2010-10-09T23:00:00.000 | F11: =RC[-2]-RC[-4] -> 2010-09-29T23:00:00.000 | G11: =RC[-5]*RC[-4] -> 111
A12: KLM | B12: 11 | C12: 12.21 | D12: 2011-11-11T00:00:00.000 | F12: =RC[-2]-RC[-4] -> 2011-10-31T00:00:00.000 | G12: =RC[-5]*RC[-4] -> 134.31
A13: LMN | B13: 12 | C13: 13.32 | D13: 2012-12-12T00:00:00.000 | F13: =RC[-2]-RC[-4] -> 2012-11-30T00:00:00.000 | G13: =RC[-5]*RC[-4] -> 159.84
A14: ZYX | B14: -1 | C14: -1.1100000000000001 | D14: 1999-12-01T00:00:00.000 | F14: =RC[-2]-RC[-4] -> 1999-12-02T00:00:00.000 | G14: =RC[-5]*RC[-4] -> 1.1100000000000001